userName,teks_ulasan,rating,tanggal_ulasan,teks_bersih,tokens,tokens_stopword,tokens_stemmed,teks_stemmed,skor_sentimen,kategori_sentimen
Isna Alib GKN DPD KalSel,memudahakn saya untukmikut rapat melalaui zoom,5,2026-03-06 01:57:30,memudahakn saya untukmikut rapat melalaui zoom,"['memudahakn', 'saya', 'untukmikut', 'rapat', 'melalaui', 'zoom']","['memudahakn', 'untukmikut', 'rapat', 'melalaui', 'zoom']","['memudahakn', 'untukmikut', 'rapat', 'lalau', 'zoom']",memudahakn untukmikut rapat lalau zoom,0.0,Positif
Abd Rahem,"Gajelas ni aplikasi tiba"" banget mau buka ga ada internet padahal jaringan gw lancar pakai device lainpun normal",1,2026-03-06 01:08:52,gajelas ni aplikasi tiba banget mau buka ga ada internet padahal jaringan gw lancar pakai device lainpun normal,"['gajelas', 'ni', 'aplikasi', 'tiba', 'banget', 'mau', 'buka', 'ga', 'ada', 'internet', 'padahal', 'jaringan', 'gw', 'lancar', 'pakai', 'device', 'lainpun', 'normal']","['gajelas', 'aplikasi', 'buka', 'internet', 'jaringan', 'lancar', 'pakai', 'device', 'lainpun', 'normal']","['gajelas', 'aplikasi', 'buka', 'internet', 'jaring', 'lancar', 'pakai', 'device', 'lain', 'normal']",gajelas aplikasi buka internet jaring lancar pakai device lain normal,0.3,Negatif
Miharja Abah,Alhamdulillah zoom bisa membantu kegiatan bersama walau terpisah jarak😊,5,2026-03-05 23:52:28,alhamdulillah zoom bisa membantu kegiatan bersama walau terpisah jarak,"['alhamdulillah', 'zoom', 'bisa', 'membantu', 'kegiatan', 'bersama', 'walau', 'terpisah', 'jarak']","['alhamdulillah', 'zoom', 'membantu', 'kegiatan', 'terpisah', 'jarak']","['alhamdulillah', 'zoom', 'bantu', 'giat', 'pisah', 'jarak']",alhamdulillah zoom bantu giat pisah jarak,0.6,Positif
Wira Dhio,good,5,2026-03-05 08:33:36,good,['good'],['good'],['good'],good,0.3,Positif
AIKK Official,saya menggunakan zoom di Windows audio tidak ada padahal aku ngobrol pakai discord aman audio saya dan saat lihat share screen tampilannya rusak,1,2026-03-05 07:13:39,saya menggunakan zoom di windows audio tidak ada padahal aku ngobrol pakai discord aman audio saya dan saat lihat share screen tampilannya rusak,"['saya', 'menggunakan', 'zoom', 'di', 'windows', 'audio', 'tidak', 'ada', 'padahal', 'aku', 'ngobrol', 'pakai', 'discord', 'aman', 'audio', 'saya', 'dan', 'saat', 'lihat', 'share', 'screen', 'tampilannya', 'rusak']","['zoom', 'windows', 'audio', 'tidak', 'ngobrol', 'pakai', 'discord', 'aman', 'audio', 'lihat', 'share', 'screen', 'tampilannya', 'rusak']","['zoom', 'windows', 'audio', 'tidak', 'ngobrol', 'pakai', 'discord', 'aman', 'audio', 'lihat', 'share', 'screen', 'tampil', 'rusak']",zoom windows audio tidak ngobrol pakai discord aman audio lihat share screen tampil rusak,-0.3,Negatif
As'adah Hanan,memudahkan kita untuk berinteraksi,5,2026-03-05 07:04:32,memudahkan kita untuk berinteraksi,"['memudahkan', 'kita', 'untuk', 'berinteraksi']","['memudahkan', 'berinteraksi']","['mudah', 'interaksi']",mudah interaksi,0.0,Positif
kalfven,keren,5,2026-03-05 06:40:43,keren,['keren'],['keren'],['keren'],keren,0.3,Positif
Aitzah,"Tolong dong fitur background nya di ini in, apa namanya.... di itu in lah pokoknya",1,2026-03-05 06:20:34,tolong dong fitur background nya di ini in apa namanya di itu in lah pokoknya,"['tolong', 'dong', 'fitur', 'background', 'nya', 'di', 'ini', 'in', 'apa', 'namanya', 'di', 'itu', 'in', 'lah', 'pokoknya']","['tolong', 'fitur', 'background', 'namanya', 'pokoknya']","['tolong', 'fitur', 'background', 'nama', 'pokok']",tolong fitur background nama pokok,0.0,Negatif
Mas Atmaja,terimakasih,5,2026-03-05 03:31:24,terimakasih,['terimakasih'],['terimakasih'],['terimakasih'],terimakasih,0.0,Positif
promkesds 2022,membantu untuk proses pertemuan online,5,2026-03-05 02:13:29,membantu untuk proses pertemuan online,"['membantu', 'untuk', 'proses', 'pertemuan', 'online']","['membantu', 'proses', 'pertemuan', 'online']","['bantu', 'proses', 'temu', 'online']",bantu proses temu online,0.3,Positif
Egidius Siku seran,bagus untuk di pakai,5,2026-03-05 02:11:47,bagus untuk di pakai,"['bagus', 'untuk', 'di', 'pakai']","['bagus', 'pakai']","['bagus', 'pakai']",bagus pakai,0.3,Positif
Rizky Tentacles,app bagus utk vc meeting,5,2026-03-05 02:07:04,app bagus utk vc meeting,"['app', 'bagus', 'utk', 'vc', 'meeting']","['app', 'bagus', 'meeting']","['app', 'bagus', 'meeting']",app bagus meeting,0.3,Positif
Jafri Zamzam,mmantaap,5,2026-03-05 01:09:02,mmantaap,['mmantaap'],['mmantaap'],['mmantaap'],mmantaap,0.0,Positif
Anas Askia,Keren,5,2026-03-05 01:00:03,keren,['keren'],['keren'],['keren'],keren,0.3,Positif
Syahputra Dian,teman aplikasi yang sama ada virtual background knapa saya tidak,5,2026-03-05 00:49:26,teman aplikasi yang sama ada virtual background knapa saya tidak,"['teman', 'aplikasi', 'yang', 'sama', 'ada', 'virtual', 'background', 'knapa', 'saya', 'tidak']","['teman', 'aplikasi', 'virtual', 'background', 'knapa', 'tidak']","['teman', 'aplikasi', 'virtual', 'background', 'knapa', 'tidak']",teman aplikasi virtual background knapa tidak,0.0,Positif
Laode Karman,tidak bisa pakai virtual background,1,2026-03-04 22:57:11,tidak bisa pakai virtual background,"['tidak', 'bisa', 'pakai', 'virtual', 'background']","['tidak', 'pakai', 'virtual', 'background']","['tidak', 'pakai', 'virtual', 'background']",tidak pakai virtual background,-0.3,Negatif
Ashar,Aplikasi samgatt membantu untuk meet virtual,5,2026-03-04 20:16:58,aplikasi samgatt membantu untuk meet virtual,"['aplikasi', 'samgatt', 'membantu', 'untuk', 'meet', 'virtual']","['aplikasi', 'samgatt', 'membantu', 'meet', 'virtual']","['aplikasi', 'samgatt', 'bantu', 'meet', 'virtual']",aplikasi samgatt bantu meet virtual,0.3,Positif
Jelita S,"ga tau ya, cuman dipake sekali, tpi okelah cukup nyaman",4,2026-03-04 17:27:56,ga tau ya cuman dipake sekali tpi okelah cukup nyaman,"['ga', 'tau', 'ya', 'cuman', 'dipake', 'sekali', 'tpi', 'okelah', 'cukup', 'nyaman']","['tau', 'cuman', 'dipake', 'tpi', 'okelah', 'nyaman']","['tau', 'cuman', 'dipake', 'tpi', 'oke', 'nyaman']",tau cuman dipake tpi oke nyaman,0.3,Positif
Aldi Salatun,"mau tanya kenapa aplikasi zoom ini kameranya tidak menyala, padahal sudah di izinkan smua tpii tetap tidak menyala kameranya tolong di bantu🙏🏻",3,2026-03-04 15:26:23,mau tanya kenapa aplikasi zoom ini kameranya tidak menyala padahal sudah di izinkan smua tpii tetap tidak menyala kameranya tolong di bantu,"['mau', 'tanya', 'kenapa', 'aplikasi', 'zoom', 'ini', 'kameranya', 'tidak', 'menyala', 'padahal', 'sudah', 'di', 'izinkan', 'smua', 'tpii', 'tetap', 'tidak', 'menyala', 'kameranya', 'tolong', 'di', 'bantu']","['aplikasi', 'zoom', 'kameranya', 'tidak', 'menyala', 'izinkan', 'smua', 'tpii', 'tidak', 'menyala', 'kameranya', 'tolong', 'bantu']","['aplikasi', 'zoom', 'kamera', 'tidak', 'nyala', 'izin', 'smua', 'tpii', 'tidak', 'nyala', 'kamera', 'tolong', 'bantu']",aplikasi zoom kamera tidak nyala izin smua tpii tidak nyala kamera tolong bantu,0.3,Positif
Owen Jayapura,bagus 1000%,5,2026-03-04 14:27:54,bagus,['bagus'],['bagus'],['bagus'],bagus,0.3,Positif
Adhy Rotinsulu,oke,5,2026-03-04 09:26:14,oke,['oke'],['oke'],['oke'],oke,0.3,Positif
Muhammad Rafi Armiasa,bagus buat meeting saya suka aplikasi zoom ini 🎭,5,2026-03-04 08:42:46,bagus buat meeting saya suka aplikasi zoom ini,"['bagus', 'buat', 'meeting', 'saya', 'suka', 'aplikasi', 'zoom', 'ini']","['bagus', 'meeting', 'suka', 'aplikasi', 'zoom']","['bagus', 'meeting', 'suka', 'aplikasi', 'zoom']",bagus meeting suka aplikasi zoom,0.6,Positif
Sasmi Syamsuddin,aplikasinya tidak bisa ter-Download. aduhh..,1,2026-03-04 07:19:58,aplikasinya tidak bisa ter download aduhh,"['aplikasinya', 'tidak', 'bisa', 'ter', 'download', 'aduhh']","['aplikasinya', 'tidak', 'ter', 'download', 'aduhh']","['aplikasi', 'tidak', 'ter', 'download', 'aduhh']",aplikasi tidak ter download aduhh,-0.3,Negatif
Ridwan Ridone,"Bagus, mudah di gunakan dan sngat membantu",5,2026-03-04 06:57:41,bagus mudah di gunakan dan sngat membantu,"['bagus', 'mudah', 'di', 'gunakan', 'dan', 'sngat', 'membantu']","['bagus', 'mudah', 'sngat', 'membantu']","['bagus', 'mudah', 'sngat', 'bantu']",bagus mudah sngat bantu,0.8999999999999999,Positif
Nurul Elvina,gk bisa ganti bacgroun padahal sekarang di haruskan mengganti bacgroun,3,2026-03-04 05:50:09,gk bisa ganti bacgroun padahal sekarang di haruskan mengganti bacgroun,"['gk', 'bisa', 'ganti', 'bacgroun', 'padahal', 'sekarang', 'di', 'haruskan', 'mengganti', 'bacgroun']","['ganti', 'bacgroun', 'haruskan', 'mengganti', 'bacgroun']","['ganti', 'bacgroun', 'harus', 'ganti', 'bacgroun']",ganti bacgroun harus ganti bacgroun,0.3,Positif
Annisa Bahasyim,backgroundnya gak bs dan camera tidak bisa juga muncul gambarnya,1,2026-03-04 03:04:36,backgroundnya gak bs dan camera tidak bisa juga muncul gambarnya,"['backgroundnya', 'gak', 'bs', 'dan', 'camera', 'tidak', 'bisa', 'juga', 'muncul', 'gambarnya']","['backgroundnya', 'camera', 'tidak', 'muncul', 'gambarnya']","['backgroundnya', 'camera', 'tidak', 'muncul', 'gambar']",backgroundnya camera tidak muncul gambar,-0.3,Negatif
Ririn Rahmawati,aplikasi sangat penting buat saya. kegunaannya sangat besar,5,2026-03-04 02:51:31,aplikasi sangat penting buat saya kegunaannya sangat besar,"['aplikasi', 'sangat', 'penting', 'buat', 'saya', 'kegunaannya', 'sangat', 'besar']","['aplikasi', 'kegunaannya']","['aplikasi', 'guna']",aplikasi guna,0.0,Positif
Maharani eka putri,kamera nyo dk biso dibuka ... atau ada update baru zoom nyo,1,2026-03-04 02:35:45,kamera nyo dk biso dibuka atau ada update baru zoom nyo,"['kamera', 'nyo', 'dk', 'biso', 'dibuka', 'atau', 'ada', 'update', 'baru', 'zoom', 'nyo']","['kamera', 'nyo', 'biso', 'dibuka', 'update', 'zoom', 'nyo']","['kamera', 'nyo', 'biso', 'buka', 'update', 'zoom', 'nyo']",kamera nyo biso buka update zoom nyo,0.0,Negatif
Warsono Vivoy18,"sy kasih ranting 5, dan harapan sy agar zoom lebih baik lagi kedepanya, biar g putus""",5,2026-03-04 00:27:35,sy kasih ranting dan harapan sy agar zoom lebih baik lagi kedepanya biar g putus,"['sy', 'kasih', 'ranting', 'dan', 'harapan', 'sy', 'agar', 'zoom', 'lebih', 'baik', 'lagi', 'kedepanya', 'biar', 'g', 'putus']","['kasih', 'ranting', 'harapan', 'zoom', 'kedepanya', 'biar', 'putus']","['kasih', 'ranting', 'harap', 'zoom', 'depa', 'biar', 'putus']",kasih ranting harap zoom depa biar putus,0.3,Positif
Qudrotul Fadilah,"Hp lawas sekarang UDH GK BISA YA GESS. ini developer udh gak mikirin Os lama Android 8.1. sekarang hp lawas udh gk bisa download karna gk kompatibel. masa harus ganti hp demi satu aplikasi doank ? menyusahkan pengguna hp lawas, padahal semua agenda sekarang kalo meeting selalu pake zoom.",1,2026-03-03 22:14:22,hp lawas sekarang udh gk bisa ya gess ini developer udh gak mikirin os lama android sekarang hp lawas udh gk bisa download karna gk kompatibel masa harus ganti hp demi satu aplikasi doank menyusahkan pengguna hp lawas padahal semua agenda sekarang kalo meeting selalu pake zoom,"['hp', 'lawas', 'sekarang', 'udh', 'gk', 'bisa', 'ya', 'gess', 'ini', 'developer', 'udh', 'gak', 'mikirin', 'os', 'lama', 'android', 'sekarang', 'hp', 'lawas', 'udh', 'gk', 'bisa', 'download', 'karna', 'gk', 'kompatibel', 'masa', 'harus', 'ganti', 'hp', 'demi', 'satu', 'aplikasi', 'doank', 'menyusahkan', 'pengguna', 'hp', 'lawas', 'padahal', 'semua', 'agenda', 'sekarang', 'kalo', 'meeting', 'selalu', 'pake', 'zoom']","['lawas', 'udh', 'gess', 'developer', 'udh', 'mikirin', 'android', 'lawas', 'udh', 'download', 'karna', 'kompatibel', 'ganti', 'aplikasi', 'doank', 'menyusahkan', 'pengguna', 'lawas', 'agenda', 'meeting', 'pake', 'zoom']","['lawas', 'udh', 'gess', 'developer', 'udh', 'mikirin', 'android', 'lawas', 'udh', 'download', 'karna', 'kompatibel', 'ganti', 'aplikasi', 'doank', 'susah', 'guna', 'lawas', 'agenda', 'meeting', 'pake', 'zoom']",lawas udh gess developer udh mikirin android lawas udh download karna kompatibel ganti aplikasi doank susah guna lawas agenda meeting pake zoom,0.6,Negatif
Rachel anindy437,"selalu bermasalah pada bagian virtual background, tidak bisa menambah background dari perangkat sendiri",1,2026-03-03 08:43:27,selalu bermasalah pada bagian virtual background tidak bisa menambah background dari perangkat sendiri,"['selalu', 'bermasalah', 'pada', 'bagian', 'virtual', 'background', 'tidak', 'bisa', 'menambah', 'background', 'dari', 'perangkat', 'sendiri']","['bermasalah', 'virtual', 'background', 'tidak', 'menambah', 'background', 'perangkat']","['masalah', 'virtual', 'background', 'tidak', 'tambah', 'background', 'perangkat']",masalah virtual background tidak tambah background perangkat,-0.3,Negatif
devid clerifachnidi,mantap,5,2026-03-03 03:45:57,mantap,['mantap'],['mantap'],['mantap'],mantap,0.3,Positif
Syai bah,bagus aplikasinya unk belajar onlen,5,2026-03-03 00:17:06,bagus aplikasinya unk belajar onlen,"['bagus', 'aplikasinya', 'unk', 'belajar', 'onlen']","['bagus', 'aplikasinya', 'unk', 'belajar', 'onlen']","['bagus', 'aplikasi', 'unk', 'ajar', 'onlen']",bagus aplikasi unk ajar onlen,0.3,Positif
Dodi Bolla,"bug tidak bisa buka kamera saat zoom, layarnya gelap padahal kamera sudah on... hp realme c51s",1,2026-03-03 00:05:22,bug tidak bisa buka kamera saat zoom layarnya gelap padahal kamera sudah on hp realme c s,"['bug', 'tidak', 'bisa', 'buka', 'kamera', 'saat', 'zoom', 'layarnya', 'gelap', 'padahal', 'kamera', 'sudah', 'on', 'hp', 'realme', 'c', 's']","['bug', 'tidak', 'buka', 'kamera', 'zoom', 'layarnya', 'gelap', 'kamera', 'realme']","['bug', 'tidak', 'buka', 'kamera', 'zoom', 'layar', 'gelap', 'kamera', 'realme']",bug tidak buka kamera zoom layar gelap kamera realme,-0.6,Negatif
Sitti Nur Haffida,please add background feature on android..,2,2026-03-03 00:02:47,please add background feature on android,"['please', 'add', 'background', 'feature', 'on', 'android']","['please', 'add', 'background', 'feature', 'android']","['please', 'add', 'background', 'feature', 'android']",please add background feature android,0.0,Negatif
491_Elza Meyda,"sekarang kenapa tidak bisa ganti BG? minta tolong🙏🙏, fitur ganti background ada kan di semua perangkat terutama di hp ANDROID, dulu bisa tapi kenapa sekarang malah tidak bisa?, saya kesulitan saat rapat² yang mengharuskan memakai background, apalagi kalau misalkan saya/orang lain sedang tidak bisa memakai laptop (sedang di luar(tidak membawa laptop), rusak/tdk memiliki laptop) dan mengharuskan memakai hp, terima kasih atas perhatiannya🙏",1,2026-03-02 15:25:15,sekarang kenapa tidak bisa ganti bg minta tolong fitur ganti background ada kan di semua perangkat terutama di hp android dulu bisa tapi kenapa sekarang malah tidak bisa saya kesulitan saat rapat yang mengharuskan memakai background apalagi kalau misalkan saya orang lain sedang tidak bisa memakai laptop sedang di luar tidak membawa laptop rusak tdk memiliki laptop dan mengharuskan memakai hp terima kasih atas perhatiannya,"['sekarang', 'kenapa', 'tidak', 'bisa', 'ganti', 'bg', 'minta', 'tolong', 'fitur', 'ganti', 'background', 'ada', 'kan', 'di', 'semua', 'perangkat', 'terutama', 'di', 'hp', 'android', 'dulu', 'bisa', 'tapi', 'kenapa', 'sekarang', 'malah', 'tidak', 'bisa', 'saya', 'kesulitan', 'saat', 'rapat', 'yang', 'mengharuskan', 'memakai', 'background', 'apalagi', 'kalau', 'misalkan', 'saya', 'orang', 'lain', 'sedang', 'tidak', 'bisa', 'memakai', 'laptop', 'sedang', 'di', 'luar', 'tidak', 'membawa', 'laptop', 'rusak', 'tdk', 'memiliki', 'laptop', 'dan', 'mengharuskan', 'memakai', 'hp', 'terima', 'kasih', 'atas', 'perhatiannya']","['tidak', 'ganti', 'tolong', 'fitur', 'ganti', 'background', 'perangkat', 'android', 'tidak', 'kesulitan', 'rapat', 'mengharuskan', 'memakai', 'background', 'orang', 'tidak', 'memakai', 'laptop', 'tidak', 'membawa', 'laptop', 'rusak', 'tdk', 'memiliki', 'laptop', 'mengharuskan', 'memakai', 'terima', 'kasih', 'perhatiannya']","['tidak', 'ganti', 'tolong', 'fitur', 'ganti', 'background', 'perangkat', 'android', 'tidak', 'sulit', 'rapat', 'harus', 'pakai', 'background', 'orang', 'tidak', 'pakai', 'laptop', 'tidak', 'bawa', 'laptop', 'rusak', 'tdk', 'milik', 'laptop', 'harus', 'pakai', 'terima', 'kasih', 'perhati']",tidak ganti tolong fitur ganti background perangkat android tidak sulit rapat harus pakai background orang tidak pakai laptop tidak bawa laptop rusak tdk milik laptop harus pakai terima kasih perhati,-0.2999999999999999,Negatif
Baskara Adhita,"tolong dong kalo bikin update jangan yang nyusahin. masa ganti virtual background pake file yg kita punya sendiri aja nggak bisa, malah maksain yg dari app aja",1,2026-03-02 15:07:49,tolong dong kalo bikin update jangan yang nyusahin masa ganti virtual background pake file yg kita punya sendiri aja nggak bisa malah maksain yg dari app aja,"['tolong', 'dong', 'kalo', 'bikin', 'update', 'jangan', 'yang', 'nyusahin', 'masa', 'ganti', 'virtual', 'background', 'pake', 'file', 'yg', 'kita', 'punya', 'sendiri', 'aja', 'nggak', 'bisa', 'malah', 'maksain', 'yg', 'dari', 'app', 'aja']","['tolong', 'bikin', 'update', 'jangan', 'nyusahin', 'ganti', 'virtual', 'background', 'pake', 'file', 'nggak', 'maksain', 'app']","['tolong', 'bikin', 'update', 'jangan', 'nyusahin', 'ganti', 'virtual', 'background', 'pake', 'file', 'nggak', 'maksain', 'app']",tolong bikin update jangan nyusahin ganti virtual background pake file nggak maksain app,-0.3,Negatif
Rahma Nabiilah,kamera zoomnya kok gak bisa yaa gimana caranya biar bisa on camera di zoom,3,2026-03-02 12:29:45,kamera zoomnya kok gak bisa yaa gimana caranya biar bisa on camera di zoom,"['kamera', 'zoomnya', 'kok', 'gak', 'bisa', 'yaa', 'gimana', 'caranya', 'biar', 'bisa', 'on', 'camera', 'di', 'zoom']","['kamera', 'zoomnya', 'yaa', 'gimana', 'biar', 'camera', 'zoom']","['kamera', 'zoomnya', 'yaa', 'gimana', 'biar', 'camera', 'zoom']",kamera zoomnya yaa gimana biar camera zoom,0.0,Negatif
FAHMI GH,"Kamera tidak berfungsi walaupun sudah aktif, sudah di install ulang dan masih tidak berfungsi juga",1,2026-03-02 07:33:19,kamera tidak berfungsi walaupun sudah aktif sudah di install ulang dan masih tidak berfungsi juga,"['kamera', 'tidak', 'berfungsi', 'walaupun', 'sudah', 'aktif', 'sudah', 'di', 'install', 'ulang', 'dan', 'masih', 'tidak', 'berfungsi', 'juga']","['kamera', 'tidak', 'berfungsi', 'aktif', 'install', 'ulang', 'tidak', 'berfungsi']","['kamera', 'tidak', 'fungsi', 'aktif', 'install', 'ulang', 'tidak', 'fungsi']",kamera tidak fungsi aktif install ulang tidak fungsi,0.0,Negatif
Jordan Wuling,ok,4,2026-03-02 07:00:58,ok,['ok'],[],[],,0.3,Positif
Mahyudin Yudi,bagus,5,2026-03-02 05:19:02,bagus,['bagus'],['bagus'],['bagus'],bagus,0.3,Positif
Fiana Jayadi,Bergabung dengan zoom sulit. akhirnya lihat you tube yg mudah.,5,2026-03-02 05:04:02,bergabung dengan zoom sulit akhirnya lihat you tube yg mudah,"['bergabung', 'dengan', 'zoom', 'sulit', 'akhirnya', 'lihat', 'you', 'tube', 'yg', 'mudah']","['bergabung', 'zoom', 'sulit', 'lihat', 'tube', 'mudah']","['gabung', 'zoom', 'sulit', 'lihat', 'tube', 'mudah']",gabung zoom sulit lihat tube mudah,0.0,Positif
elssa Yunitta,pas oncam tdk dilihat sama perangkat lain,1,2026-03-02 03:36:28,pas oncam tdk dilihat sama perangkat lain,"['pas', 'oncam', 'tdk', 'dilihat', 'sama', 'perangkat', 'lain']","['pas', 'oncam', 'tdk', 'perangkat']","['pas', 'oncam', 'tdk', 'perangkat']",pas oncam tdk perangkat,0.0,Negatif
Muhammad Fateh,bagus sinyalnya,5,2026-03-02 02:03:33,bagus sinyalnya,"['bagus', 'sinyalnya']","['bagus', 'sinyalnya']","['bagus', 'sinyal']",bagus sinyal,0.3,Positif
arman syah,"woi gw pengen login, kode email nya udah bener kok nggk bisa login apk dongo",1,2026-03-01 23:18:32,woi gw pengen login kode email nya udah bener kok nggk bisa login apk dongo,"['woi', 'gw', 'pengen', 'login', 'kode', 'email', 'nya', 'udah', 'bener', 'kok', 'nggk', 'bisa', 'login', 'apk', 'dongo']","['woi', 'pengen', 'login', 'kode', 'email', 'udah', 'bener', 'nggk', 'login', 'apk', 'dongo']","['woi', 'ken', 'login', 'kode', 'email', 'udah', 'bener', 'nggk', 'login', 'apk', 'dongo']",woi ken login kode email udah bener nggk login apk dongo,0.3,Negatif
maan Chan,okok,5,2026-03-01 15:19:43,okok,['okok'],['okok'],['okok'],okok,0.0,Positif
Ramlah Basrih,baguss buat belajar dari pengalaman baruu,5,2026-03-01 10:38:40,baguss buat belajar dari pengalaman baruu,"['baguss', 'buat', 'belajar', 'dari', 'pengalaman', 'baruu']","['baguss', 'belajar', 'pengalaman', 'baruu']","['baguss', 'ajar', 'alam', 'baruu']",baguss ajar alam baruu,0.0,Positif
Nasikin Joko purnomo,mantap,5,2026-03-01 07:08:15,mantap,['mantap'],['mantap'],['mantap'],mantap,0.3,Positif
herli anto,"aplikasi ampas, minta update terus, memakan banyak data🤬",1,2026-03-01 03:09:47,aplikasi ampas minta update terus memakan banyak data,"['aplikasi', 'ampas', 'minta', 'update', 'terus', 'memakan', 'banyak', 'data']","['aplikasi', 'ampas', 'update', 'memakan', 'data']","['aplikasi', 'ampas', 'update', 'makan', 'data']",aplikasi ampas update makan data,-0.3,Negatif
Inriyani W.S,tolong tambahkan fitur membuat breakout room dari tablet dan hp,4,2026-03-01 02:04:13,tolong tambahkan fitur membuat breakout room dari tablet dan hp,"['tolong', 'tambahkan', 'fitur', 'membuat', 'breakout', 'room', 'dari', 'tablet', 'dan', 'hp']","['tolong', 'tambahkan', 'fitur', 'breakout', 'room', 'tablet']","['tolong', 'tambah', 'fitur', 'breakout', 'room', 'tablet']",tolong tambah fitur breakout room tablet,0.0,Positif
Mu'ad Roziqin,iyes,5,2026-02-28 14:09:47,iyes,['iyes'],['iyes'],['iyes'],iyes,0.0,Positif
Raden Andalas,terima kasih atas konpirmasnya dan aku bersyukur Alhamdulillah mudah2an fositip panjang umur dan hidup bahagia selamanya Anogerah berlimpah limpah limpah terwujud kepadaku skrg jugak Aaminnn yerobebb FOLLOW 🤲🤲🤲🤲🤲👍👍👍👍👍❤️❤️❤️❤️❤️👍😭🥰🥰🥰🥰 Aaminnn,5,2026-02-28 13:22:02,terima kasih atas konpirmasnya dan aku bersyukur alhamdulillah mudah an fositip panjang umur dan hidup bahagia selamanya anogerah berlimpah limpah limpah terwujud kepadaku skrg jugak aaminnn yerobebb follow aaminnn,"['terima', 'kasih', 'atas', 'konpirmasnya', 'dan', 'aku', 'bersyukur', 'alhamdulillah', 'mudah', 'an', 'fositip', 'panjang', 'umur', 'dan', 'hidup', 'bahagia', 'selamanya', 'anogerah', 'berlimpah', 'limpah', 'limpah', 'terwujud', 'kepadaku', 'skrg', 'jugak', 'aaminnn', 'yerobebb', 'follow', 'aaminnn']","['terima', 'kasih', 'konpirmasnya', 'bersyukur', 'alhamdulillah', 'mudah', 'fositip', 'umur', 'hidup', 'bahagia', 'anogerah', 'berlimpah', 'limpah', 'limpah', 'terwujud', 'kepadaku', 'skrg', 'jugak', 'aaminnn', 'yerobebb', 'follow', 'aaminnn']","['terima', 'kasih', 'konpirmasnya', 'syukur', 'alhamdulillah', 'mudah', 'fositip', 'umur', 'hidup', 'bahagia', 'anogerah', 'limpah', 'limpah', 'limpah', 'wujud', 'kepada', 'skrg', 'jugak', 'aaminnn', 'yerobebb', 'follow', 'aaminnn']",terima kasih konpirmasnya syukur alhamdulillah mudah fositip umur hidup bahagia anogerah limpah limpah limpah wujud kepada skrg jugak aaminnn yerobebb follow aaminnn,0.8999999999999999,Positif
Mariano Luahomar Soares,VERRY GOOD,5,2026-02-28 12:37:36,verry good,"['verry', 'good']","['verry', 'good']","['verry', 'good']",verry good,0.3,Positif
Umy Leha,mengapa akhir2 ini sya tidak bsa oncame semua setting aplksi dan izin aplksi serta izin camera ny sudah,1,2026-02-28 11:57:17,mengapa akhir ini sya tidak bsa oncame semua setting aplksi dan izin aplksi serta izin camera ny sudah,"['mengapa', 'akhir', 'ini', 'sya', 'tidak', 'bsa', 'oncame', 'semua', 'setting', 'aplksi', 'dan', 'izin', 'aplksi', 'serta', 'izin', 'camera', 'ny', 'sudah']","['sya', 'tidak', 'bsa', 'oncame', 'setting', 'aplksi', 'izin', 'aplksi', 'izin', 'camera']","['sya', 'tidak', 'bsa', 'oncame', 'setting', 'aplksi', 'izin', 'aplksi', 'izin', 'camera']",sya tidak bsa oncame setting aplksi izin aplksi izin camera,0.0,Negatif
sada haluma,"Mudah dioprasikan, nyaman,anyak vitur",5,2026-02-28 09:03:05,mudah dioprasikan nyaman anyak vitur,"['mudah', 'dioprasikan', 'nyaman', 'anyak', 'vitur']","['mudah', 'dioprasikan', 'nyaman', 'anyak', 'vitur']","['mudah', 'dioprasikan', 'nyaman', 'anyak', 'vitur']",mudah dioprasikan nyaman anyak vitur,0.6,Positif
Siti Nabila,kenapa aplikasi zoom ini tidak bisa di download di hp saya,1,2026-02-28 08:37:18,kenapa aplikasi zoom ini tidak bisa di download di hp saya,"['kenapa', 'aplikasi', 'zoom', 'ini', 'tidak', 'bisa', 'di', 'download', 'di', 'hp', 'saya']","['aplikasi', 'zoom', 'tidak', 'download']","['aplikasi', 'zoom', 'tidak', 'download']",aplikasi zoom tidak download,-0.3,Negatif
Melky Melky,agak bagus,2,2026-02-28 04:56:03,agak bagus,"['agak', 'bagus']",['bagus'],['bagus'],bagus,0.3,Negatif
Move Chanel,"sudah lumayan bagus, hanya sangat mengecewakan tidak dpat mengganti background.",1,2026-02-28 04:51:01,sudah lumayan bagus hanya sangat mengecewakan tidak dpat mengganti background,"['sudah', 'lumayan', 'bagus', 'hanya', 'sangat', 'mengecewakan', 'tidak', 'dpat', 'mengganti', 'background']","['lumayan', 'bagus', 'mengecewakan', 'tidak', 'dpat', 'mengganti', 'background']","['lumayan', 'bagus', 'kecewa', 'tidak', 'dpat', 'ganti', 'background']",lumayan bagus kecewa tidak dpat ganti background,0.3,Negatif
Ayu Sasmita,bagus sih tapi nggak bisa ganti virtual backgroundnya di hp redmi not 12 🥲 apa lagi nggak ada leptop,2,2026-02-28 02:44:06,bagus sih tapi nggak bisa ganti virtual backgroundnya di hp redmi not apa lagi nggak ada leptop,"['bagus', 'sih', 'tapi', 'nggak', 'bisa', 'ganti', 'virtual', 'backgroundnya', 'di', 'hp', 'redmi', 'not', 'apa', 'lagi', 'nggak', 'ada', 'leptop']","['bagus', 'nggak', 'ganti', 'virtual', 'backgroundnya', 'redmi', 'not', 'nggak', 'leptop']","['bagus', 'nggak', 'ganti', 'virtual', 'backgroundnya', 'redmi', 'not', 'nggak', 'leptop']",bagus nggak ganti virtual backgroundnya redmi not nggak leptop,0.0,Negatif
Tamzil Uncu,mantap,5,2026-02-28 01:01:59,mantap,['mantap'],['mantap'],['mantap'],mantap,0.3,Positif
