userName,teks_ulasan,rating,tanggal_ulasan,teks_bersih,tokens,tokens_stopword,tokens_stemmed,teks_stemmed,skor_sentimen,kategori_sentimen
Achmad Riyadhi,"terimakasih, sangat membantu setiap zoom meeting",5,2026-06-20 11:19:32,terimakasih sangat membantu setiap zoom meeting,"['terimakasih', 'sangat', 'membantu', 'setiap', 'zoom', 'meeting']","['terimakasih', 'membantu', 'zoom', 'meeting']","['terimakasih', 'bantu', 'zoom', 'meeting']",terimakasih bantu zoom meeting,0.3,Positif
Ivonne Alenda,"Aplikasi yg selalu ku pake saat kuliah di masa pandemi, kualitas videonya oke, fitur"" yg tersedia juga oke. selalu pakai ini buat online meeting.",5,2026-06-20 08:19:17,aplikasi yg selalu ku pake saat kuliah di masa pandemi kualitas videonya oke fitur yg tersedia juga oke selalu pakai ini buat online meeting,"['aplikasi', 'yg', 'selalu', 'ku', 'pake', 'saat', 'kuliah', 'di', 'masa', 'pandemi', 'kualitas', 'videonya', 'oke', 'fitur', 'yg', 'tersedia', 'juga', 'oke', 'selalu', 'pakai', 'ini', 'buat', 'online', 'meeting']","['aplikasi', 'pake', 'kuliah', 'pandemi', 'kualitas', 'videonya', 'oke', 'fitur', 'tersedia', 'oke', 'pakai', 'online', 'meeting']","['aplikasi', 'pake', 'kuliah', 'pandemi', 'kualitas', 'video', 'oke', 'fitur', 'sedia', 'oke', 'pakai', 'online', 'meeting']",aplikasi pake kuliah pandemi kualitas video oke fitur sedia oke pakai online meeting,0.6,Positif
Fani Sugiarto,the application is comfortable to use and not Tibetan,5,2026-06-20 07:58:20,the application is comfortable to use and not tibetan,"['the', 'application', 'is', 'comfortable', 'to', 'use', 'and', 'not', 'tibetan']","['application', 'comfortable', 'use', 'not', 'tibetan']","['application', 'comfortable', 'use', 'not', 'tibetan']",application comfortable use not tibetan,0.0,Positif
Nurul Fathima,rapat menjadi lebih efektif dengan zoom,5,2026-06-20 07:32:29,rapat menjadi lebih efektif dengan zoom,"['rapat', 'menjadi', 'lebih', 'efektif', 'dengan', 'zoom']","['rapat', 'efektif', 'zoom']","['rapat', 'efektif', 'zoom']",rapat efektif zoom,0.3,Positif
Tanisha Davis,b aja,2,2026-06-20 07:08:20,b aja,"['b', 'aja']",[],[],,0.0,Negatif
Junita S,bagus,5,2026-06-20 04:17:10,bagus,['bagus'],['bagus'],['bagus'],bagus,0.3,Positif
ke keizz,"Zoom is a dependable video conferencing app that makes online meetings and classes easy to join. The video and audio quality are generally very good, and features like screen sharing and virtual backgrounds improve the overall experience.",5,2026-06-20 02:05:33,zoom is a dependable video conferencing app that makes online meetings and classes easy to join the video and audio quality are generally very good and features like screen sharing and virtual backgrounds improve the overall experience,"['zoom', 'is', 'a', 'dependable', 'video', 'conferencing', 'app', 'that', 'makes', 'online', 'meetings', 'and', 'classes', 'easy', 'to', 'join', 'the', 'video', 'and', 'audio', 'quality', 'are', 'generally', 'very', 'good', 'and', 'features', 'like', 'screen', 'sharing', 'and', 'virtual', 'backgrounds', 'improve', 'the', 'overall', 'experience']","['zoom', 'dependable', 'video', 'conferencing', 'app', 'makes', 'online', 'meetings', 'classes', 'easy', 'join', 'video', 'audio', 'quality', 'generally', 'good', 'features', 'like', 'screen', 'sharing', 'virtual', 'backgrounds', 'improve', 'overall', 'experience']","['zoom', 'dependable', 'video', 'conferencing', 'app', 'makes', 'online', 'meetings', 'classes', 'easy', 'join', 'video', 'audio', 'quality', 'generally', 'good', 'features', 'like', 'screen', 'sharing', 'virtual', 'backgrounds', 'improve', 'overall', 'experience']",zoom dependable video conferencing app makes online meetings classes easy join video audio quality generally good features like screen sharing virtual backgrounds improve overall experience,0.3,Positif
Raihan Rizieq,Bagus dan lancar dalam komunikasinya. Tolong ditambahkan fitur trankripsi di ruang diskusi,4,2026-06-20 01:38:45,bagus dan lancar dalam komunikasinya tolong ditambahkan fitur trankripsi di ruang diskusi,"['bagus', 'dan', 'lancar', 'dalam', 'komunikasinya', 'tolong', 'ditambahkan', 'fitur', 'trankripsi', 'di', 'ruang', 'diskusi']","['bagus', 'lancar', 'komunikasinya', 'tolong', 'fitur', 'trankripsi', 'ruang', 'diskusi']","['bagus', 'lancar', 'komunikasi', 'tolong', 'fitur', 'trankripsi', 'ruang', 'diskusi']",bagus lancar komunikasi tolong fitur trankripsi ruang diskusi,0.6,Positif
Chania Esni,gada bg nya,1,2026-06-20 01:27:28,gada bg nya,"['gada', 'bg', 'nya']",['gada'],['gada'],gada,0.0,Negatif
Maveryn Unovelle,"semakin kesini semakin dibikin ribet nyari fitur nya, mana gd tutorialnya. mksi",2,2026-06-19 16:23:02,semakin kesini semakin dibikin ribet nyari fitur nya mana gd tutorialnya mksi,"['semakin', 'kesini', 'semakin', 'dibikin', 'ribet', 'nyari', 'fitur', 'nya', 'mana', 'gd', 'tutorialnya', 'mksi']","['kesini', 'dibikin', 'ribet', 'nyari', 'fitur', 'tutorialnya', 'mksi']","['kesini', 'bikin', 'ribet', 'nyari', 'fitur', 'tutorial', 'mksi']",kesini bikin ribet nyari fitur tutorial mksi,-0.3,Negatif
David Richard,everything is okay,5,2026-06-19 12:11:40,everything is okay,"['everything', 'is', 'okay']","['everything', 'okay']","['everything', 'okay']",everything okay,0.0,Positif
rona yanuar,rapat dari kasur tapi background kantor,5,2026-06-19 06:17:06,rapat dari kasur tapi background kantor,"['rapat', 'dari', 'kasur', 'tapi', 'background', 'kantor']","['rapat', 'kasur', 'background', 'kantor']","['rapat', 'kasur', 'background', 'kantor']",rapat kasur background kantor,0.0,Positif
Dzakiyyah Azkiya fairus,"sayang aplikasi,a berhenti sendiri padahal apk nya sangat membantu sekali,apa lagi kalau ada zoom dari PPATK pusat yg mengharuskan zoom meet",4,2026-06-19 03:49:47,sayang aplikasi a berhenti sendiri padahal apk nya sangat membantu sekali apa lagi kalau ada zoom dari ppatk pusat yg mengharuskan zoom meet,"['sayang', 'aplikasi', 'a', 'berhenti', 'sendiri', 'padahal', 'apk', 'nya', 'sangat', 'membantu', 'sekali', 'apa', 'lagi', 'kalau', 'ada', 'zoom', 'dari', 'ppatk', 'pusat', 'yg', 'mengharuskan', 'zoom', 'meet']","['sayang', 'aplikasi', 'berhenti', 'apk', 'membantu', 'zoom', 'ppatk', 'pusat', 'mengharuskan', 'zoom', 'meet']","['sayang', 'aplikasi', 'henti', 'apk', 'bantu', 'zoom', 'ppatk', 'pusat', 'harus', 'zoom', 'meet']",sayang aplikasi henti apk bantu zoom ppatk pusat harus zoom meet,0.3,Positif
FENI WULANDARI,"jelek, GK bisa masuk",1,2026-06-19 02:23:20,jelek gk bisa masuk,"['jelek', 'gk', 'bisa', 'masuk']","['jelek', 'masuk']","['jelek', 'masuk']",jelek masuk,0.0,Negatif
aidi mansuri,sangat Rekomended,5,2026-06-19 01:35:02,sangat rekomended,"['sangat', 'rekomended']",['rekomended'],['rekomended'],rekomended,0.0,Positif
anton dharma,Ga kebayang kalo g ada zoom,5,2026-06-19 01:19:06,ga kebayang kalo g ada zoom,"['ga', 'kebayang', 'kalo', 'g', 'ada', 'zoom']","['kebayang', 'zoom']","['bayang', 'zoom']",bayang zoom,0.0,Positif
Litha Pasepe,"Aplikasih ini sangat menolong, walaupun berbeda negara kami bisa di satukan dalam zoom ini.",5,2026-06-18 15:08:48,aplikasih ini sangat menolong walaupun berbeda negara kami bisa di satukan dalam zoom ini,"['aplikasih', 'ini', 'sangat', 'menolong', 'walaupun', 'berbeda', 'negara', 'kami', 'bisa', 'di', 'satukan', 'dalam', 'zoom', 'ini']","['aplikasih', 'menolong', 'berbeda', 'negara', 'satukan', 'zoom']","['aplikasih', 'tolong', 'beda', 'negara', 'satu', 'zoom']",aplikasih tolong beda negara satu zoom,0.3,Positif
Siti Rahayu,iya,5,2026-06-18 12:31:08,iya,['iya'],['iya'],['iya'],iya,0.0,Positif
Yusran 19,kenapa sya ksi bintang satu karna setiap sya msuk tdk bisa,1,2026-06-18 07:20:33,kenapa sya ksi bintang satu karna setiap sya msuk tdk bisa,"['kenapa', 'sya', 'ksi', 'bintang', 'satu', 'karna', 'setiap', 'sya', 'msuk', 'tdk', 'bisa']","['sya', 'ksi', 'bintang', 'karna', 'sya', 'msuk', 'tdk']","['sya', 'ksi', 'bintang', 'karna', 'sya', 'msuk', 'tdk']",sya ksi bintang karna sya msuk tdk,0.3,Negatif
Radeva Ardanu,good app,5,2026-06-18 06:50:53,good app,"['good', 'app']","['good', 'app']","['good', 'app']",good app,0.3,Positif
Hesty Rufina,bagus,5,2026-06-18 06:32:01,bagus,['bagus'],['bagus'],['bagus'],bagus,0.3,Positif
Firdaus Habib rahman,gak bisa virtual background,2,2026-06-18 04:23:58,gak bisa virtual background,"['gak', 'bisa', 'virtual', 'background']","['virtual', 'background']","['virtual', 'background']",virtual background,-0.3,Negatif
Regina Anggita Marpaung,"di perangkat saya tidak bisa menambah background, masalahnya di mana ya? mau update tapi udah yang paling terbaru, jaringan lancar, tolong dibantu pihak zoom",3,2026-06-18 03:13:40,di perangkat saya tidak bisa menambah background masalahnya di mana ya mau update tapi udah yang paling terbaru jaringan lancar tolong dibantu pihak zoom,"['di', 'perangkat', 'saya', 'tidak', 'bisa', 'menambah', 'background', 'masalahnya', 'di', 'mana', 'ya', 'mau', 'update', 'tapi', 'udah', 'yang', 'paling', 'terbaru', 'jaringan', 'lancar', 'tolong', 'dibantu', 'pihak', 'zoom']","['perangkat', 'tidak', 'menambah', 'background', 'update', 'udah', 'terbaru', 'jaringan', 'lancar', 'tolong', 'dibantu', 'zoom']","['perangkat', 'tidak', 'tambah', 'background', 'update', 'udah', 'baru', 'jaring', 'lancar', 'tolong', 'bantu', 'zoom']",perangkat tidak tambah background update udah baru jaring lancar tolong bantu zoom,0.0,Negatif
Lukman Hakim,sangat bagus dannmembatu dalam belajar on line,5,2026-06-18 02:52:28,sangat bagus dannmembatu dalam belajar on line,"['sangat', 'bagus', 'dannmembatu', 'dalam', 'belajar', 'on', 'line']","['bagus', 'dannmembatu', 'belajar', 'line']","['bagus', 'dannmembatu', 'ajar', 'line']",bagus dannmembatu ajar line,0.3,Positif
Jonathan Sianturi,keren,5,2026-06-17 23:05:19,keren,['keren'],['keren'],['keren'],keren,0.3,Positif
Wuma 1311,mantap,5,2026-06-17 21:40:13,mantap,['mantap'],['mantap'],['mantap'],mantap,0.3,Positif
Main Game,Good,5,2026-06-17 16:02:07,good,['good'],['good'],['good'],good,0.3,Positif
Anisa Ichsandari,"Aplikasi yang memudahkan dalam berkomunikasi jarak jauh, tanpa minimal orang dan waktunya juga panjang sehingga memudahkan orang berkomunikasi.",5,2026-06-17 14:50:21,aplikasi yang memudahkan dalam berkomunikasi jarak jauh tanpa minimal orang dan waktunya juga panjang sehingga memudahkan orang berkomunikasi,"['aplikasi', 'yang', 'memudahkan', 'dalam', 'berkomunikasi', 'jarak', 'jauh', 'tanpa', 'minimal', 'orang', 'dan', 'waktunya', 'juga', 'panjang', 'sehingga', 'memudahkan', 'orang', 'berkomunikasi']","['aplikasi', 'memudahkan', 'berkomunikasi', 'jarak', 'minimal', 'orang', 'memudahkan', 'orang', 'berkomunikasi']","['aplikasi', 'mudah', 'komunikasi', 'jarak', 'minimal', 'orang', 'mudah', 'orang', 'komunikasi']",aplikasi mudah komunikasi jarak minimal orang mudah orang komunikasi,0.0,Positif
Feli Taira,menyenangkan dan memudahkan urusan.,5,2026-06-17 14:17:50,menyenangkan dan memudahkan urusan,"['menyenangkan', 'dan', 'memudahkan', 'urusan']","['menyenangkan', 'memudahkan', 'urusan']","['senang', 'mudah', 'urus']",senang mudah urus,0.0,Positif
Restu Wijaya,sangat berguna untuk pertemuan dalam cakupan banyak orang secara virtual,5,2026-06-17 14:13:13,sangat berguna untuk pertemuan dalam cakupan banyak orang secara virtual,"['sangat', 'berguna', 'untuk', 'pertemuan', 'dalam', 'cakupan', 'banyak', 'orang', 'secara', 'virtual']","['berguna', 'pertemuan', 'cakupan', 'orang', 'virtual']","['guna', 'temu', 'cakup', 'orang', 'virtual']",guna temu cakup orang virtual,0.3,Positif
Arya Putra Prathama,"Dasar aplikasi rusak, banyak bug, ikut meeting malah tidak bisa lihat siapa yang join/siapa pesertanya, membuka komentar juga tidak bisa, tolong perbaiki itu sangat mengganggu!",1,2026-06-17 13:30:16,dasar aplikasi rusak banyak bug ikut meeting malah tidak bisa lihat siapa yang join siapa pesertanya membuka komentar juga tidak bisa tolong perbaiki itu sangat mengganggu,"['dasar', 'aplikasi', 'rusak', 'banyak', 'bug', 'ikut', 'meeting', 'malah', 'tidak', 'bisa', 'lihat', 'siapa', 'yang', 'join', 'siapa', 'pesertanya', 'membuka', 'komentar', 'juga', 'tidak', 'bisa', 'tolong', 'perbaiki', 'itu', 'sangat', 'mengganggu']","['dasar', 'aplikasi', 'rusak', 'bug', 'meeting', 'tidak', 'lihat', 'join', 'pesertanya', 'membuka', 'komentar', 'tidak', 'tolong', 'perbaiki', 'mengganggu']","['dasar', 'aplikasi', 'rusak', 'bug', 'meeting', 'tidak', 'lihat', 'join', 'serta', 'buka', 'komentar', 'tidak', 'tolong', 'baik', 'ganggu']",dasar aplikasi rusak bug meeting tidak lihat join serta buka komentar tidak tolong baik ganggu,-1.0,Negatif
Andromax 82,Ok,5,2026-06-17 12:16:07,ok,['ok'],[],[],,0.3,Positif
nana ruhayana,Zoom nya jelas dan terang,5,2026-06-17 12:13:30,zoom nya jelas dan terang,"['zoom', 'nya', 'jelas', 'dan', 'terang']","['zoom', 'terang']","['zoom', 'terang']",zoom terang,0.3,Positif
Annisa Wardani,"Zoom is an excellent video conferencing platform for both professional and personal use. The audio and video quality are reliable, and the interface is simple and easy to navigate. Features such as screen sharing, virtual backgrounds, and meeting recordings make online collaboration much more effective. Overall, Zoom is a dependable tool for communication and remote meetings.",5,2026-06-17 11:02:57,zoom is an excellent video conferencing platform for both professional and personal use the audio and video quality are reliable and the interface is simple and easy to navigate features such as screen sharing virtual backgrounds and meeting recordings make online collaboration much more effective overall zoom is a dependable tool for communication and remote meetings,"['zoom', 'is', 'an', 'excellent', 'video', 'conferencing', 'platform', 'for', 'both', 'professional', 'and', 'personal', 'use', 'the', 'audio', 'and', 'video', 'quality', 'are', 'reliable', 'and', 'the', 'interface', 'is', 'simple', 'and', 'easy', 'to', 'navigate', 'features', 'such', 'as', 'screen', 'sharing', 'virtual', 'backgrounds', 'and', 'meeting', 'recordings', 'make', 'online', 'collaboration', 'much', 'more', 'effective', 'overall', 'zoom', 'is', 'a', 'dependable', 'tool', 'for', 'communication', 'and', 'remote', 'meetings']","['zoom', 'excellent', 'video', 'conferencing', 'platform', 'professional', 'personal', 'use', 'audio', 'video', 'quality', 'reliable', 'interface', 'simple', 'easy', 'navigate', 'features', 'screen', 'sharing', 'virtual', 'backgrounds', 'meeting', 'recordings', 'make', 'online', 'collaboration', 'much', 'effective', 'overall', 'zoom', 'dependable', 'tool', 'communication', 'remote', 'meetings']","['zoom', 'excellent', 'video', 'conferencing', 'platform', 'professional', 'personal', 'use', 'audio', 'video', 'quality', 'reliable', 'interface', 'simple', 'easy', 'navigate', 'features', 'screen', 'sharing', 'virtual', 'backgrounds', 'meeting', 'recordings', 'make', 'online', 'collaboration', 'much', 'effective', 'overall', 'zoom', 'dependable', 'tool', 'communication', 'remote', 'meetings']",zoom excellent video conferencing platform professional personal use audio video quality reliable interface simple easy navigate features screen sharing virtual backgrounds meeting recordings make online collaboration much effective overall zoom dependable tool communication remote meetings,0.0,Positif
Sandrina Junior,"Zoom itu aplikasi yang menurutku sangat membantu, apalagi buat belajar atau meeting online. Suara dan videonya cukup jelas, jadi enak buat ngobrol walaupun nggak ketemu langsung. Cara pakainya juga gampang, tinggal masuk link langsung bisa gabung. Aku juga suka karena bisa dipakai di HP atau laptop. Pokoknya Zoom itu praktis banget dan layak bintang 5.",5,2026-06-17 10:25:49,zoom itu aplikasi yang menurutku sangat membantu apalagi buat belajar atau meeting online suara dan videonya cukup jelas jadi enak buat ngobrol walaupun nggak ketemu langsung cara pakainya juga gampang tinggal masuk link langsung bisa gabung aku juga suka karena bisa dipakai di hp atau laptop pokoknya zoom itu praktis banget dan layak bintang,"['zoom', 'itu', 'aplikasi', 'yang', 'menurutku', 'sangat', 'membantu', 'apalagi', 'buat', 'belajar', 'atau', 'meeting', 'online', 'suara', 'dan', 'videonya', 'cukup', 'jelas', 'jadi', 'enak', 'buat', 'ngobrol', 'walaupun', 'nggak', 'ketemu', 'langsung', 'cara', 'pakainya', 'juga', 'gampang', 'tinggal', 'masuk', 'link', 'langsung', 'bisa', 'gabung', 'aku', 'juga', 'suka', 'karena', 'bisa', 'dipakai', 'di', 'hp', 'atau', 'laptop', 'pokoknya', 'zoom', 'itu', 'praktis', 'banget', 'dan', 'layak', 'bintang']","['zoom', 'aplikasi', 'menurutku', 'membantu', 'belajar', 'meeting', 'online', 'suara', 'videonya', 'enak', 'ngobrol', 'nggak', 'ketemu', 'langsung', 'pakainya', 'gampang', 'tinggal', 'masuk', 'link', 'langsung', 'gabung', 'suka', 'dipakai', 'laptop', 'pokoknya', 'zoom', 'praktis', 'layak', 'bintang']","['zoom', 'aplikasi', 'turut', 'bantu', 'ajar', 'meeting', 'online', 'suara', 'video', 'enak', 'ngobrol', 'nggak', 'ketemu', 'langsung', 'pakai', 'gampang', 'tinggal', 'masuk', 'link', 'langsung', 'gabung', 'suka', 'pakai', 'laptop', 'pokok', 'zoom', 'praktis', 'layak', 'bintang']",zoom aplikasi turut bantu ajar meeting online suara video enak ngobrol nggak ketemu langsung pakai gampang tinggal masuk link langsung gabung suka pakai laptop pokok zoom praktis layak bintang,1.0,Positif
Genz Venom,"⭐⭐⭐⭐⭐ (5/5) Zoom merupakan aplikasi konferensi video yang sangat membantu untuk kebutuhan rapat, pembelajaran online, webinar, maupun komunikasi jarak jauh. Aplikasi ini memiliki antarmuka yang sederhana dan mudah digunakan, sehingga cocok untuk berbagai kalangan, mulai dari pelajar, mahasiswa, hingga profesional. Salah satu keunggulan Zoom adalah kualitas video dan audio yang cukup stabil, bahkan pada jaringan internet yang tidak terlalu cepat. Fitur-fitur seperti berbagi layar (screen sharing)",5,2026-06-17 07:30:39,zoom merupakan aplikasi konferensi video yang sangat membantu untuk kebutuhan rapat pembelajaran online webinar maupun komunikasi jarak jauh aplikasi ini memiliki antarmuka yang sederhana dan mudah digunakan sehingga cocok untuk berbagai kalangan mulai dari pelajar mahasiswa hingga profesional salah satu keunggulan zoom adalah kualitas video dan audio yang cukup stabil bahkan pada jaringan internet yang tidak terlalu cepat fitur fitur seperti berbagi layar screen sharing,"['zoom', 'merupakan', 'aplikasi', 'konferensi', 'video', 'yang', 'sangat', 'membantu', 'untuk', 'kebutuhan', 'rapat', 'pembelajaran', 'online', 'webinar', 'maupun', 'komunikasi', 'jarak', 'jauh', 'aplikasi', 'ini', 'memiliki', 'antarmuka', 'yang', 'sederhana', 'dan', 'mudah', 'digunakan', 'sehingga', 'cocok', 'untuk', 'berbagai', 'kalangan', 'mulai', 'dari', 'pelajar', 'mahasiswa', 'hingga', 'profesional', 'salah', 'satu', 'keunggulan', 'zoom', 'adalah', 'kualitas', 'video', 'dan', 'audio', 'yang', 'cukup', 'stabil', 'bahkan', 'pada', 'jaringan', 'internet', 'yang', 'tidak', 'terlalu', 'cepat', 'fitur', 'fitur', 'seperti', 'berbagi', 'layar', 'screen', 'sharing']","['zoom', 'aplikasi', 'konferensi', 'video', 'membantu', 'kebutuhan', 'rapat', 'pembelajaran', 'online', 'webinar', 'komunikasi', 'jarak', 'aplikasi', 'memiliki', 'antarmuka', 'sederhana', 'mudah', 'cocok', 'kalangan', 'pelajar', 'mahasiswa', 'profesional', 'salah', 'keunggulan', 'zoom', 'kualitas', 'video', 'audio', 'stabil', 'jaringan', 'internet', 'tidak', 'cepat', 'fitur', 'fitur', 'berbagi', 'layar', 'screen', 'sharing']","['zoom', 'aplikasi', 'konferensi', 'video', 'bantu', 'butuh', 'rapat', 'ajar', 'online', 'webinar', 'komunikasi', 'jarak', 'aplikasi', 'milik', 'antarmuka', 'sederhana', 'mudah', 'cocok', 'kalang', 'ajar', 'mahasiswa', 'profesional', 'salah', 'unggul', 'zoom', 'kualitas', 'video', 'audio', 'stabil', 'jaring', 'internet', 'tidak', 'cepat', 'fitur', 'fitur', 'bagi', 'layar', 'screen', 'sharing']",zoom aplikasi konferensi video bantu butuh rapat ajar online webinar komunikasi jarak aplikasi milik antarmuka sederhana mudah cocok kalang ajar mahasiswa profesional salah unggul zoom kualitas video audio stabil jaring internet tidak cepat fitur fitur bagi layar screen sharing,0.8999999999999999,Positif
Mohamad Mas vio,"this apps so amazing meeting with client,study aor anything more easy connect with zoom 🥰",5,2026-06-17 06:37:41,this apps so amazing meeting with client study aor anything more easy connect with zoom,"['this', 'apps', 'so', 'amazing', 'meeting', 'with', 'client', 'study', 'aor', 'anything', 'more', 'easy', 'connect', 'with', 'zoom']","['apps', 'amazing', 'meeting', 'client', 'study', 'aor', 'anything', 'easy', 'connect', 'zoom']","['apps', 'amazing', 'meeting', 'client', 'study', 'aor', 'anything', 'easy', 'connect', 'zoom']",apps amazing meeting client study aor anything easy connect zoom,0.0,Positif
Rika Chen,baik,5,2026-06-17 05:10:17,baik,['baik'],[],[],,0.0,Positif
Devin Revel,good,5,2026-06-17 03:56:55,good,['good'],['good'],['good'],good,0.3,Positif
Steven Lunsford,ini gimana sih cara ganti background nya kok gak ada kayaknya dulu ada soalnya lama gak pakai zoom,1,2026-06-17 02:33:11,ini gimana sih cara ganti background nya kok gak ada kayaknya dulu ada soalnya lama gak pakai zoom,"['ini', 'gimana', 'sih', 'cara', 'ganti', 'background', 'nya', 'kok', 'gak', 'ada', 'kayaknya', 'dulu', 'ada', 'soalnya', 'lama', 'gak', 'pakai', 'zoom']","['gimana', 'ganti', 'background', 'kayaknya', 'pakai', 'zoom']","['gimana', 'ganti', 'background', 'kayak', 'pakai', 'zoom']",gimana ganti background kayak pakai zoom,0.0,Negatif
Erlisty,aplikasinya ngga bisa di instal pdhl memori udh banyak yang kosong sllu gagal di instal,1,2026-06-17 00:46:08,aplikasinya ngga bisa di instal pdhl memori udh banyak yang kosong sllu gagal di instal,"['aplikasinya', 'ngga', 'bisa', 'di', 'instal', 'pdhl', 'memori', 'udh', 'banyak', 'yang', 'kosong', 'sllu', 'gagal', 'di', 'instal']","['aplikasinya', 'ngga', 'instal', 'pdhl', 'memori', 'udh', 'kosong', 'sllu', 'gagal', 'instal']","['aplikasi', 'ngga', 'instal', 'pdhl', 'memori', 'udh', 'kosong', 'sllu', 'gagal', 'instal']",aplikasi ngga instal pdhl memori udh kosong sllu gagal instal,-0.6,Negatif
Faj Com,trimakasih zoom workplace GBU,5,2026-06-16 22:38:58,trimakasih zoom workplace gbu,"['trimakasih', 'zoom', 'workplace', 'gbu']","['trimakasih', 'zoom', 'workplace', 'gbu']","['trimakasih', 'zoom', 'workplace', 'gbu']",trimakasih zoom workplace gbu,0.0,Positif
Tri Hartini,mantap,5,2026-06-16 14:22:22,mantap,['mantap'],['mantap'],['mantap'],mantap,0.3,Positif
Rifki Farhan,pengiriman kode ke email untuk login sangat lama sekali,1,2026-06-16 11:42:33,pengiriman kode ke email untuk login sangat lama sekali,"['pengiriman', 'kode', 'ke', 'email', 'untuk', 'login', 'sangat', 'lama', 'sekali']","['pengiriman', 'kode', 'email', 'login']","['kirim', 'kode', 'email', 'login']",kirim kode email login,0.0,Negatif
Justian,very good,5,2026-06-16 08:21:15,very good,"['very', 'good']",['good'],['good'],good,0.3,Positif
Yunita,bagus,5,2026-06-15 23:23:17,bagus,['bagus'],['bagus'],['bagus'],bagus,0.3,Positif
Ahmad Rifai,Zoom Workplace Aplikasi Terbaik 👍🏻,5,2026-06-15 19:54:06,zoom workplace aplikasi terbaik,"['zoom', 'workplace', 'aplikasi', 'terbaik']","['zoom', 'workplace', 'aplikasi', 'terbaik']","['zoom', 'workplace', 'aplikasi', 'baik']",zoom workplace aplikasi baik,0.0,Positif
Elsa Dina,cukup baik dan berfungsi,5,2026-06-15 11:08:03,cukup baik dan berfungsi,"['cukup', 'baik', 'dan', 'berfungsi']",['berfungsi'],['fungsi'],fungsi,0.0,Positif
Naomi Kim,Saya kasih bintang 1 karena pas saya mau masuk akun malah tidak bisa 🙏😞,1,2026-06-15 07:37:27,saya kasih bintang karena pas saya mau masuk akun malah tidak bisa,"['saya', 'kasih', 'bintang', 'karena', 'pas', 'saya', 'mau', 'masuk', 'akun', 'malah', 'tidak', 'bisa']","['kasih', 'bintang', 'pas', 'masuk', 'akun', 'tidak']","['kasih', 'bintang', 'pas', 'masuk', 'akun', 'tidak']",kasih bintang pas masuk akun tidak,0.0,Negatif
앙가라,좋아요,5,2026-06-15 03:03:09,,[],[],[],,0.0,Positif
Dody TP,komunikasi lebih efisien,5,2026-06-15 02:38:57,komunikasi lebih efisien,"['komunikasi', 'lebih', 'efisien']","['komunikasi', 'efisien']","['komunikasi', 'efisien']",komunikasi efisien,0.0,Positif
Nur Apt,baik,5,2026-06-15 00:06:56,baik,['baik'],[],[],,0.0,Positif
Ikhwan Aulia,ribet pake zoom mah!!!!!,1,2026-06-14 14:28:16,ribet pake zoom mah,"['ribet', 'pake', 'zoom', 'mah']","['ribet', 'pake', 'zoom', 'mah']","['ribet', 'pake', 'zoom', 'mah']",ribet pake zoom mah,-0.3,Negatif
Revanda Maulana,Tidak bisa jalan di browser,1,2026-06-14 12:47:45,tidak bisa jalan di browser,"['tidak', 'bisa', 'jalan', 'di', 'browser']","['tidak', 'jalan', 'browser']","['tidak', 'jalan', 'browser']",tidak jalan browser,-0.3,Negatif
